date,dc_source,posted,prism_url,title
,HESS,i,https://doi.org/10.5194/hess-22-5847-2018,Studying catchment storm response using event- and pre-event-water volumes as fractions of precipitation rather than discharge
,Freshwater Biology,i,https://onlinelibrary.wiley.com/doi/abs/10.1111/fwb.13211?af=R,The spatial scale of homogenisation and differentiation in Chihuahuan Desert fish assemblages
,Water Resources Research,i,https://agupubs.onlinelibrary.wiley.com/doi/abs/10.1029/2018WR022964?af=R,Wildfire Smoke Cools Summer River and Stream Water Temperatures
,Water Resources Research,i,https://agupubs.onlinelibrary.wiley.com/doi/abs/10.1029/2017WR022172?af=R,What Are the Key Catchment Characteristics Affecting Spatial Differences in Riverine Water Quality?
,Limnologica,i,https://www.sciencedirect.com/science/article/pii/S0075951117302797?dgcid=rss_sd_all,Effects of land-use changes on structural characteristics of tropical high-altitude Andean headwater streams
,Limnologica,i,https://www.sciencedirect.com/science/article/pii/S0075951117303171?dgcid=rss_sd_all,Assessing land use and land cover influence on surface water quality using a parametric weighted distance function
,Limnologica,i,https://www.sciencedirect.com/science/article/pii/S0075951118300483?dgcid=rss_sd_all,Ecological quality assessment of running waters in the North Aegean catchment with diatom metrics and multivariate approach
,Water Research,i,https://www.sciencedirect.com/science/article/pii/S0043135418309813?dgcid=rss_sd_all,Hydrological Drought Persistence and Recovery in the CONUS: a Multi-stage Framework Considering Water Quantity and Quality
2018-11-24,Biogeochemistry,y,http://link.springer.com/10.1007/s10533-018-0526-y,Differential influence of landscape features and climate on nitrogen and phosphorus transport throughout the watershed
,Biogeochemistry,i,http://link.springer.com/10.1007/s10533-018-0449-7,The impact of flooding on aquatic ecosystem services
,Biogeochemistry,i,http://link.springer.com/10.1007/s10533-018-0431-4,Restored floodplains enhance denitrification compared to naturalized floodplains in agricultural streams
,Biogeochemistry,i,http://link.springer.com/10.1007/s10533-017-0417-7,Freeze–thaw processes and intense rainfall: the one-two punch for high sediment and nutrient loads from mid-Atlantic watersheds
,Biogeochemistry,i,http://link.springer.com/10.1007/s10533-018-0502-6,Watershed ‘chemical cocktails’: forming novel elemental combinations in Anthropocene fresh waters
,Biogeochemistry,i,http://link.springer.com/10.1007/s10533-018-0423-4,"In the path of the Hurricane: impact of Hurricane Irene and Tropical Storm Lee on watershed hydrology and biogeochemistry from North Carolina to Maine, USA"
2018-11-27,HESS,y,https://doi.org/10.5194/hess-2018-588,Future projections of temperature and mixing regime of European temperate lakes
2018-11-27,Freshwater Biology,y,https://onlinelibrary.wiley.com/doi/abs/10.1111/fwb.13214?af=R,Spatial and temporal variation in nitrogen fixation and its importance to phytoplankton in phosphorus‐rich lakes
2018-11-28,Water Resources Research,y,https://onlinelibrary.wiley.com/doi/abs/10.1029/2018WR023370?af=R,Key Factors Affecting Temporal Variability in Stream Water Quality
,Biogeosciences,i,https://doi.org/10.5194/bg-15-7059-2018,Integrating multimedia models to assess nitrogen losses from the Mississippi River basin to the Gulf of Mexico
2018-11-30,JAWRA,y,https://onlinelibrary.wiley.com/doi/abs/10.1111/1752-1688.12702?af=R,An Application of the T‐TEL Assessment Method to Evaluate Connectivity in a Lake‐Dominated Watershed after Drought
2018-11-30,Frontiers in Ecology and Evolution,y,https://www.frontiersin.org/articles/10.3389/fevo.2018.00201,"Snapshot Surveys for Lake Monitoring, More Than a Shot in the Dark"
2018-11-30,Biogeosciences,i,https://doi.org/10.5194/bg-15-7141-2018,Filtration artefacts in bacterial community composition can affect the outcome of dissolved organic matter biolability assays
2018-11-30,Water Research,y,https://www.sciencedirect.com/science/article/pii/S0043135418308339?dgcid=rss_sd_all,Nitrogen cycling processes within stormwater control measures: A review and call for research
2018-12-02,Water Research,y,https://www.sciencedirect.com/science/article/pii/S0043135418309813?dgcid=rss_sd_all,Hydrological drought persistence and recovery over the CONUS: A multi-stage framework considering water quantity and quality
2018-12-02,Water Research,i,https://www.sciencedirect.com/science/article/pii/S0043135418308339?dgcid=rss_sd_all,Nitrogen cycling processes within stormwater control measures: A review and call for research
2018-12-03,Limnology and Oceanography: Letters,y,https://onlinelibrary.wiley.com/doi/abs/10.1002/lol2.10099?af=R,Climate warming response of mountain lakes affected by variations in snow
2018-12-05,Limnology and Oceanography,y,https://onlinelibrary.wiley.com/doi/abs/10.1002/lno.11096?af=R,Nutrient enrichment homogenizes taxonomic and functional diversity of benthic macroinvertebrate assemblages in shallow lakes
2018-12-05,Oikos,y,https://onlinelibrary.wiley.com/doi/abs/10.1111/oik.05809?af=R,Effects of macrophytes on lake‐water quality across latitudes: a meta‐analysis
